,title,doi,year,exists_in_openalex
3406,Urban aerosol chemistry at a land–water transition site during summer – Part 1: Impact of agricultural and industrial ammonia emissions,10.5194/acp-21-13051-2021,2021,True
3407,Barriers to Nursing Home Care for Nonelderly Rural Residents,10.1177/0733464817746772,2017,True
3408,"Use of soil moisture active passive satellite data and WorldClim 2.0 data to predict the potential distribution of visceral leishmaniasis and its vector &lt;em&gt;Lutzomyia longipalpis&lt;/em&gt; in Sao Paulo and Bahia states, Brazil",10.4081/gh.2022.1095,2022,True
3409,Predictors of Depressive Symptoms in Rural Farm Women Aged 50 and Over,10.14574/ojrnhc.v20i2.631,2020,True
3410,"Spatial analysis of borrow pits along the Platte River in south-central Nebraska, USA, in 1957 and 2016",10.13014/k29021zk,2018,True
3411,Increasing the CalFresh Participation Rate in The County of Santa Cruz,10.31979/etd.66mt-hsr5,2019,True
3412,Point Mapping Integrates Data Collection and Weed Control Operations,10.1017/inp.2017.5,2017,True
3413,What factors make consumers in the USA buy hemp products? Evidence from Nielsen consumer panel data,10.1186/s40100-023-00245-y,2023,True
3414,‘Left behind places’: what are they and why do they matter?,10.1093/cjres/rsad044,2023,True
3415,"Perceptions of risk to compound coastal water events: A case study in eastern North Carolina, USA",10.1016/j.pdisas.2022.100266,2022,True
3416,Patterns of handgun divestment among handgun owners in California,10.1186/s40621-021-00362-6,2022,True
3417,Immigration Policy Levers for US Innovation and Startups,10.3386/w27040,2020,True
3418,Explaining political polarization in environmental governance using narrative analysis,10.5751/es-10999-240304,2019,True
3419,"Food Trucks Driving Gentrification in Austin, Texas",10.33182/bc.v11i1.1427,2021,True
3420,"Estimating the Associations between SNAP and Food Insecurity, Obesity, and Food Purchases with Imperfect Administrative Measures of Participation",10.3386/w24412,2018,True
3421,Strengthening Informal Supports to Promote Behavioral Health of Youth With Intellectual and/or Developmental Disabilities in Rural Communities,10.1016/bs.irrdd.2017.07.001,2017,True
3422,Assessment of the Financial Benefits from Wind Farms in US Rural Locations,10.3390/jrfm15100423,2022,True
3423,Opportunities and challenges for farm to early care and education in settings serving low-income children,10.1080/19320248.2018.1547670,2018,True
3424,An Examination of Wage and Income Inequality within the American Farmworker Community,10.1177/2331502418786707,2018,True
3425,Volatility and Change in Suburban Nonprofit Safety Nets,10.7758/rsf.2023.9.2.06,2023,True
3426,"Growing Food, Growing a Movement: How Structural Racism Affects Immigrant Farmers",10.5304/jafscd.2020.094.038,2020,True
3427,Using State and Transition Models to Show Economic Interdependence of Ecological Sites at the Ranch Level,10.1016/j.rama.2017.05.008,2017,True
3428,"Association between health care access and food insecurity among lower-income older adults with multiple chronic conditions in Washington State, USA",10.1017/s1368980022001240,2022,True
3429,"Feeling the stress and strain – race, economics, and the educational experiences of Latinx emergent bilinguals in a ‘new’ destination school",10.1080/13613324.2018.1511534,2018,True
3430,Using the AGsploration: the Science of Maryland Agriculture Curriculum as a Tool to Increase Youth Appreciation and Understanding of Agriculture and Science,10.5195/jyd.2016.467,2017,True
3431,Rural public library assets: A multi‐classification study,10.1002/pra2.2017.14505401146,2017,True
3432,Natural resource extraction and mortality in the United States,10.1016/j.jenvman.2019.01.033,2019,True
3433,Big Data under Obama and Trump: The Data-Fueled U.S. Presidency,10.17645/pag.v6i4.1565,2018,True
3434,"Derailed Values: Planning Education, External Funding, and Environmental Justice in New Orleans Rail Planning",10.1177/0739456x17712810,2017,True
3435,Preferred Water Resource Information Sources and Learning Opportunities in the Pacific Northwest,10.4195/nse2018.07.0014,2018,True
3436,Quality of communication about medicines in United States hospitals: A national retrospective study,10.1016/j.sapharm.2016.09.005,2017,True
3437,Rural and Small Town Residents and the Rural Mystique: Data from Texas,10.1111/ruso.12227,2018,True
3438,"Investigation of the Microenvironment, Land Cover Characteristics, and Social Vulnerability of Heat-Vulnerable Bus Stops in Knoxville, Tennessee",10.20944/preprints202306.0778.v1,2023,True
3439,Underestimating College Student Food Insecurity: Marginally Food Secure Students May Not Be Food Secure,10.3390/nu14153142,2022,True
3440,The North Carolina Food Pantry Organizational Capability and Mapping Study: Research Brief and Pilot Study,10.5304/jafscd.2019.091.031,2019,True
3441,"Does the Theory of Voluntary Sector Failure Provide Insight into Food Pantries? A Case Study of a Network of Food Pantries in San Diego, CA",10.1007/s11266-018-00047-7,2018,True
3442,ECONOMIC CONSEQUENCES FOR TREE FRUIT INTERMEDIARIES FROM SHOCKS,10.1017/aae.2017.15,2017,True
3443,Missed Work Due to Occupational Illness among Hispanic Horse Workers,10.13031/jash.12735,2018,True
3444,Understanding equipment management for planting cover crops,10.2489/jswc.2023.0818a,2023,True
3445,"Food safety, reputation, and regulation",10.1002/aepp.13315,2022,True
3446,Open configuration options Agglomeration and Congestion in Latin America,10.18235/0003984,2022,True
3447,Managed movement increases metapopulation viability of the endangered red wolf,10.1002/jwmg.21397,2017,True
3448,Barriers to Healthy Eating and Physical Activity in the Mississippi Delta,10.51250/jheal.v2i1.36,2022,True
3449,Assessing the Motivations for Migration Among West African Immigrants in Itinerant Retail Trading in Ghana,10.36005/jplm.v1i1.12,2019,True
3450,Community response to a sustainable restoration plan for a superfund site,10.1007/s11356-018-1885-6,2018,True
3451,Iowa Dependent Adult Abuse Prosecutions From 2006 Through 2015: Health Care Providers’ Concern,10.1177/2150131916688561,2017,True
3452,Cultural worldview and genetically modified food policy preferences,10.1016/j.foodpol.2018.09.003,2018,True
3453,Investigating confounders of the association between survival and adjuvant radiation therapy after breast conserving surgery in a sample of elderly breast Cancer patients in Appalachia,10.1186/s12885-019-6263-3,2019,True
3454,Essays on Sustainability and Poverty,10.18130/v3qw15,2017,True
3455,The Effect of the Field of Study on the Higher Education Wage Premium — Evidence from Israel,10.1111/labr.12150,2019,True
3456,Fine-scale assessment of cross-boundary wildfire events in the western United States,10.5194/nhess-19-1755-2019,2019,True
3457,Resource Description and Access Adoption and Implementation in Public Libraries in the United States,10.5860/lrts.63n2.119,2019,True
3458,"Neither, either, or both? Who sees GM and non‐GM food labels?",10.1002/jaa2.32,2022,True
3459,Forward-looking farmers owning multiple potential wetland restoration sites: implications for efficient restoration,10.1007/s00267-018-1002-0,2018,True
3460,Performance of rapid floristic quality assessment indices for increasing cost-effectiveness of wetland condition evaluation,10.1016/j.ecolind.2018.08.003,2018,True
3461,An Environmental Assessment of the North and South Carolina Coasts,10.1016/b978-0-12-805068-2.00044-9,2019,True
3462,"Local and social: entrepreneurs, information network effects, and economic growth",10.1007/s00168-019-00915-0,2019,True
3463,Persistence of anaemia among Samoan preschool age children: a longitudinal study,10.1017/s1368980021003980,2021,True
3464,Harmonizing the Assessment of the Impacts of Natural Disasters to Florida Agriculture,10.32473/edis-fe1075-2020,2020,True
3465,"Faith and Doubt in an American Working Landscape: The Importance of Scale, Work, and Place in Rural Development Planning",10.1080/08941920.2018.1511021,2018,True
3466,"Risk Factors Associated with Congenital Syphilis, Georgia, 2008-2015",10.1155/2023/3958406,2023,True
3467,Racialization and International Security,10.1162/isec_a_00470,2023,True
3468,Profiles of Ethiopian centenarians: A qualitative inquiry,10.5195/aa.2021.336,2021,True
3469,Modelling the time at which overcrowding and feed interruption emerge on the swine premises under movement restrictions during a classical swine fever outbreak,10.1017/s1751731116001609,2017,True
3470,Which communication channels shape normative perceptions about buying local food? An application of social exposure,10.1007/s10460-019-09926-1,2019,True
3471,Public health risks arising from food supply chains: Challenges and opportunities,10.1002/nav.22020,2021,True
3472,Emerging Horticultural Research and Education Opportunities in Myanmar,10.21273/hortsci11904-17,2017,True
3473,Integrating human activity into food environments can better predict cardiometabolic diseases in the United States,10.1038/s41467-023-42667-8,2023,True
3474,Modeling anthropogenic nitrogen flow for the Niantic River catchment in coastal New England,10.1007/s10980-018-0667-3,2018,True
3475,On Average Establishment Size across Sectors and Countriesy,10.3386/w24968,2018,True
3476,"Exponential growth of private coastal infrastructure influenced by geography and race in South Carolina, USA",10.1038/s41598-024-59740-x,2024,True
3477,The Institutional and Cultural Logics of Legal Commensuration: Blood Money and Negotiated Justice in China,10.1086/689268,2017,True
3478,U.S. Small-Scale Livestock Operation Approach to Biosecurity,10.3390/agriculture13112086,2023,True
3479,"Floral Visitors to Helianthus verticillatus, a Rare Sunflower Species in the Southern United States",10.21273/hortsci15394-20,2020,True
3480,An Economic Evaluation of Food Safety Education Interventions: Estimates and Critical Data Gaps,10.4315/0362-028x.jfp-16-510,2017,True
3481,A Study on the Impact of COVID-19 on Adolescent Food Insecurity: How Adolescent Food Insecurity is associated with Future Food Insecurity,10.47611/jsrhs.v11i3.2990,2022,True
3482,Migrant Selection and Sorting during the Great American Drought,10.31235/osf.io/wm2p3,2021,True
3483,The Adoption of the Latin American Rice Production System through the Implementation of Advanced Field Management Practices: An Evaluation of Technology Adoption Patterns and the Impact on Yield in Colombia,10.5109/2558911,2020,True
3484,The Genetic Improvement of Black Walnut for Timber Production,10.1002/9781119414735.ch6,2018,True
3485,Implementation resistance and the human dimensions of connectivity planning,10.1002/pan3.10525,2023,True
3486,Obesity Prevalence and Voting Behaviors in the 2016 US Presidential Election,10.5993/ajhb.42.5.2,2018,True
3487,Summaries of Doctoral Dissertations,10.1017/s002205071700050x,2017,True
3488,Engaging in Conversations about Climate Change with Cattle Producers,10.54718/gtif2359,2020,True
3489,"Colorado's forest resources, 2004-2013",10.2737/rmrs-rb-23,2017,True
3490,"Early 20th Century American Exceptionalism: Production, Trade and Diffusion of the Automobile",10.3386/w26121,2019,True
3491,"Interactions Between Diet, Physical Activity, and the Sociocultural Environment for Older Adult Health in the Urban Subarctic",10.1007/s10900-019-00737-3,2019,True
3492,Training early childcare providers in evidence-based nutrition strategies can help improve nutrition policies and practices of early childcare centres serving racially and ethnically diverse children from low-income families,10.1017/s1368980017003573,2017,True
3493,Equity in Unemployment Insurance Benefit Access,10.17848/pol2021-026,2021,True
3494,Population-level changes in lifestyle risk factors for cardiovascular disease in the Heart of New Ulm Project,10.1016/j.pmedr.2019.01.018,2019,True
3495,"Key Factors Influencing the Incidence of West Nile Virus in Burleigh County, North Dakota",10.3390/ijerph15091928,2018,True
3496,The Pennsylvania Longitudinal Study of Parents and Children (PALSPAC) Twin Registry,10.1017/thg.2019.98,2019,True
3497,Mapping Firescapes for Wild and Prescribed Fire Management: A Landscape Classification Approach,10.3390/land12122180,2023,True
3498,"Exploring the Challenges and Opportunities for Integrated Governance of Food, Energy, and Water Systems: Insights from Three Mid-Sized Cities",10.31219/osf.io/tkx78,2023,True
3499,Returns to Controlling a Neglected Tropical Disease: Schistosomiasis Control Programme and Education Outcomes in Nigeria,10.1093/jae/ejy003,2018,True
3500,Food Safety Risks and Issues Associated With Farming and Handling Practices for Organic Certified Fresh Produce,10.1016/b978-0-12-812060-6.00007-6,2019,True
3501,"Proceedings of the fifth international symposium on fire economics, planning, and policy: ecosystem services and wildfires",10.2737/psw-gtr-261,2019,True
3502,Creating Personas on Which to Build Services for Latinx Users: A Proof of Concept,10.1080/01616846.2018.1528573,2018,True
3503,On the Origins of the Idea of Ending Poverty,10.3386/w27808,2020,True
3504,Grocery Cooperatives as Governing Institutions in Neighborhood Commercial Corridors,10.1177/1078087417709999,2017,True
3505,"Food and beverage marketing in schools: school superintendents’ perspectives and practices after the healthy, Hunger-Free Kids Act",10.1017/s1368980019004804,2020,True
3506,Market channel selections by US nursery plant producers: a multivariate nonparametric fractional regression analysis,10.1080/02664763.2017.1381670,2017,True
3507,The use of gamma-survey measurements to better understand radon potential in urban areas,10.1016/j.scitotenv.2017.07.022,2017,True
3508,Communication strategies for designing Facebook advertising campaigns to recruit rural participants to develop healthcare delivery interventions,10.1017/cts.2020.5,2020,True
3509,Individually mark–mass release–resight study elucidates effects of patch characteristics and distance on host patch location by an insect herbivore,10.1111/een.12383,2017,True
3510,"Root distributions, precipitation, and soil structure converge to govern soil organic carbon depth distributions",10.1016/j.geoderma.2023.116569,2023,True
3511,Impact of Syrian Refugees on Male Immigrants’ Labor Market Outcomes in Jordan,10.1177/01979183221149015,2023,True
3512,Foodsheds in Virtual Water Flow Networks: A Spectral Graph Theory Approach,10.3389/fict.2017.00017,2017,True
3513,Specific dairy foods and risk of frailty in older women: a prospective cohort study,10.1186/s12916-024-03280-8,2024,True
3514,Using stakeholder marketing and social responsibility for new product development in higher education: a business Spanish model,10.1080/08841241.2017.1384782,2017,True
3515,Residential proximity to greenspace and human birth defects,10.1289/isee.2022.o-op-209,2022,True
3516,"“The Day That Changed My Life, Again”: The Testimonio of a Latino DACAmented Teacher",10.1007/s11256-017-0412-2,2017,True
3517,Cartographic Depictions of Louisiana Land Loss: A Tool for Sustainable Policies,10.3390/su10030763,2018,True
3518,Gardening at School for New Good Life: Entrepreneurship for Sustainable Education in the Public Schools in Nepal,10.46743/2160-3715/2023.6104,2023,True
3519,Automated Mapping of Historical Native American Land Allotments at the Standing Rock Sioux Reservation Using Geographic Information Systems,10.3390/ijgi10030183,2021,True
3520,Multiple lineages of Streptomyces produce antimicrobials within passalid beetle galleries across eastern North America,10.7554/elife.65091,2021,True
3521,Tropical cyclones and coastal communities: the dialectics of social and environmental change in the Sundarban delta,10.1080/19480881.2017.1326701,2017,True
3522,Adapting to Climate Risk? Local Population Dynamics in the United States,10.21203/rs.3.rs-3183191/v1,2023,True
3523,"Misrecognition in a Sustainability Capital: Race, Representation, and Transportation Survey Response Rates in the Portland Metropolitan Area",10.3390/su11164336,2019,True
3524,Statistical considerations of nonrandom treatment applications reveal region-wide benefits of widespread post-fire restoration action,10.1038/s41467-022-31102-z,2022,True
3525,Needs Analysis in Technical Vocational Education and Training (TVET) Programs for Sustainable Development of Women in Cambodian Hair and Beauty Industry,10.30880/jtet.2021.13.03.011,2021,True
3526,Estuarine Dissolved Oxygen History Inferred from Sedimentary Trace Metal and Organic Matter Preservation,10.1007/s12237-019-00580-8,2019,True
3527,A survey of recommended practices made by veterinary practitioners to cow-calf operations in the United States and Canada,10.15232/pas.2017-01642,2017,True
3528,"Child Temperament, Maternal Feeding Practices, and Parenting Styles and Their Influence on Obesogenic Behaviors in Hispanic Preschool Children",10.1177/1059840518771485,2018,True
3529,Improving Agricultural Policy Decisions through Replications,10.1111/1746-692x.12413,2023,True
3530,The Impact of Round II Urban Empowerment Zones on Local Communities,10.25148/etd.fi12110704,2017,True
3531,Institutional inefficiency: small farms starve India’s economy,10.1108/jepp-05-2016-0021,2017,True
3532,"Consequences of reduced light for flower production in conifer-invaded meadows of the Pacific Northwest, U.S.A",10.1007/s11258-019-00952-x,2019,True
3533,Heterogeneity in Damages from A Pandemic,10.3386/w30658,2022,True
3534,Guidelines for Pomegranate Nutrient Management in Florida,10.32473/edis-hs1347-2019,2019,True
3535,Increased Precision in County-Level Volume Estimates in the United States National Forest Inventory With Area-Level Small Area Estimation,10.3389/ffgc.2022.769917,2022,True
3536,"Lack of a substantive effect of insurance and the national US payment system on the relative distribution of surgical cases among hospitals in the State of Iowa: A retrospective, observational, cohort study",10.1016/j.jclinane.2018.08.006,2018,True
3537,Long Term Land Use Effects of New Rail Investment: Lessons from San Diego,10.3390/urbansci2010006,2018,True
3538,Social Representational Communities and the Imagined Antebellum South,10.1080/02732173.2017.1396944,2018,True
3539,Willingness to Pay for Retail Location and Product Origin of Christmas Trees,10.1017/age.2017.5,2017,True
3540,Water Market Participation and Agricultural Land Values,10.3368/le.100.1.102122-0091r,2023,True
3541,National Alliance for Water Innovation (NAWI) Municipal Sector Technology Roadmap 2021,10.2172/1782448,2021,True
3542,Do Nutrient Management Plans Actually Manage Nutrients? Evidence from a Nationally‐Representative Survey of Hog Producers,10.1093/aepp/ppx057,2018,True
3543,"The effects of landscape and yard features on mammal diversity in residential yards within Northwest Arkansas, USA",10.1007/s11252-023-01433-w,2023,True
3544,Technology and economic behavior: A theoretical framework,10.1002/hbe2.211,2020,True
3545,Response of Surface Runoff and Sediment to the Conversion of a Marginal Grassland to a Switchgrass (Panicum virgatum) Bioenergy Feedstock System,10.3390/land11040540,2022,True
3546,A case study of independent grocers in the U.S. rural Midwest,10.1080/19320248.2018.1434096,2018,True
3547,What Do Local Government Education Managers Do to Boost Learning Outcomes?,10.35489/bsg-rise-wp_2021/064,2021,True
3548,FOOD DESERT AND ITS IMPACT ON MORTALITY AND HOSPITALIZATION IN HEART FAILURE PATIENTS,10.1016/s0735-1097(19)31468-8,2019,True
3549,Analyzing the effects of estuarine freshwater fluxes on fish abundance using artificial neural network ensembles,10.1016/j.ecolmodel.2017.05.010,2017,True
3550,Predicting effects of future development on a territorial forest songbird: methodology matters,10.1007/s10980-017-0586-8,2017,True
3551,Action Plan for Asian Citrus Psyllid and Huanglongbing (Citrus Greening) in California,10.5070/c471049054,2020,True
3552,"America, Jump-started: World War II R&amp;D and the Takeoff of the U.S. Innovation System",10.3386/w27375,2020,True
3553,The Varieties of Nonprofit Organizations and Local Hazard Mitigation Efforts,10.20899/jpna.8.2.239-259,2022,True
3554,Are U.S. consumers willing to pay more by the lake? An analysis of preferences for Great Lakes region fish,10.1017/age.2022.18,2022,True
3555,Who’s adopting the smarter lunchroom approach? Individual characteristics of innovative food service directors,10.1016/j.evalprogplan.2016.08.023,2017,True
3556,An empirical analysis of the interactions between environmental regulations and economic growth,10.33915/etd.4508,2019,True
3557,Locus of control as a mediator between posttraumatic stress and suicide risk: rural implications,10.1080/10371656.2018.1504759,2018,True
3558,Local Malaria Elimination,10.1093/ae/tmx060,2017,True
3559,"State-Mandated Nutrition, Physical Activity, and Screen Time Policies in Child Care Centers",10.1177/1524839917729125,2017,True
3560,"A brewery in a foundry, a winery in a strip mall: adaptive reuse by food enterprises",10.1057/s41289-019-00085-7,2019,True
3561,Tariff and US Paper Products Trade,10.1093/forsci/fxy028,2018,True
3562,Toward a history of housing market analysis,10.1108/ijhma-09-2017-0080,2018,True
3563,Spatial variability in retail gasoline markets,10.1007/s41685-019-00104-z,2019,True
3564,Occupational Prestige: The Status Component of Socioeconomic Status,10.1525/collabra.92882,2024,True
3565,Mortgage Choice in Rural Housing,10.1080/10511482.2017.1389762,2017,True
3566,"Audience Segmentation of Kentucky Mothers by Nonparticipation Status in the Special Supplemental Nutrition Program for Women, Infants, and Children",10.1080/10495142.2017.1293585,2017,True
3567,A spatially explicit approach to modeling biological productivity and economic attractiveness of short-rotation woody crops in the eastern USA,10.1186/s13705-019-0211-6,2019,True
3568,Biosolids as an Alternative Fertilizer for Kentucky Bluegrass Sod Production in Wisconsin,10.2135/cropsci2016.05.0367,2017,True
3569,Local Obesity Prevalence and Corporate Policies,10.1142/s2010139218500076,2018,True
3570,Social dilemmas and poor water quality in household water systems,10.5194/hess-26-1187-2022,2022,True
3571,Vacancy Chains,10.21799/frbp.wp.2020.28,2020,True
3572,"Prototypical career paths in urban, suburban, and rural locations in the United States",10.1177/0018726720929406,2020,True
3573,"Spatial Heterogeneity, Broadband, and New Firm Formation",10.12776/qip.v20i3.791,2017,True
3574,Mary Jane Rocks the Vote: The Impact of Climate Context on Support for Cannabis Initiatives,10.1111/polp.12248,2018,True
3575,Assessing peer effects and subsidy impacts in conservation technology adoption: Application to grazing management choices,10.1002/jaa2.26,2022,True
3576,"Usual Intake of Flavonoids Is Inversely Associated with Metabolic Syndrome in African American and White Males but Not Females in Baltimore City, Maryland, USA",10.3390/nu14091924,2022,True
3577,Natural and Anthropogenic Influences on the Mating System of the Common Morning Glory,10.1093/jhered/esx104,2017,True
3578,The Institutional Drivers Contributing to Billionaire Wealth at the Sector Level,10.25148/crcp.11.1.010593,2023,True
3579,"Internet of Texas Water Data Update: Use Cases for Flood, Drought, and Surface Water–Groundwater Interactions",10.21423/twj.v11i1.7109,2020,True
3580,The <i>Boechera</i> model system for evolutionary ecology,10.1002/ajb2.16090,2022,True
3581,A temporal analysis of the association between breast cancer and socioeconomic and environmental factors,10.1007/s10708-017-9824-5,2017,True
3582,Reshaping Maine Woods Destinations for Twenty-First-Century Tourists,10.53558/hdvw4563,2019,True
3583,A Variable Selection Method for Small Area Estimation Modeling of the Proficiency of Adult Competency,10.3390/stats5030041,2022,True
3584,Structure and Food Price Inflation,10.1515/jafio-2017-0004,2017,True
3585,Hepatitis C Treatment at a Rural Navajo Health Clinic Using Project ECHO,10.14574/ojrnhc.v20i2.634,2020,True
3586,The Emergence and Sustainability of Urban Entomology,10.1146/annurev-ento-012423-110612,2024,True
3587,"Household Food Insecurity, Coping Strategies, and Happiness: The Case of Two Public Housing Communities",10.5304/jafscd.2020.093.018,2020,True
3588,Local Plant and Insect Conservation Evaluated with Organizational Identity Theory,10.3390/jzbg4010019,2023,True
3589,‘Out of Place around Other People’: Experiences of Young People Who Live with Food Insecurity,10.1111/chso.12270,2018,True
3590,Do Localities Benefit from Natural Resource Extraction?,10.5547/01956574.41.5.ddes,2020,True
3591,Corals and Coral Reefs ☆,10.1016/b978-0-12-809633-8.02191-9,2017,True
3592,"Soil chemical and biological fertility, microbial community structure and dynamics in successive and fallow sugarcane planting systems",10.1080/21683565.2019.1666075,2019,True
3593,"Cash transfer programmes, poverty reduction and empowerment of women in South Africa",10.1163/2210-7975_hrd-4022-2015065,2018,True
3594,Different Definitions and Great Expectations: Farmers' Market Consumers and Local Foods,10.34068/joe.55.03.10,2017,True
3595,Using ecosystem health and welfare assessments to determine impacts of wild collection for public aquariums,10.1371/journal.pone.0285198,2023,True
3596,Integration-Regulation and rural suicide: a test of three alternative models,10.31390/gradschool_dissertations.3904,2022,True
3597,A two-regime analysis of the COVID-19 vaccine distribution process,10.1108/jhlscm-10-2021-0106,2023,True
3598,The Death of Administrative Democracy,10.5195/lawreview.2020.774,2021,True
3599,Firm Investments in Artificial Intelligence Technologies and Changes in Workforce Composition,10.3386/w31325,2023,True
3600,"Selective Daily Mobility Bias in the Community Food Environment: Case Study of Greater Hartford, Connecticut",10.3390/nu15020404,2023,True
