,title,doi,year,exists_in_openalex
5326,A pilot study exploring the impacts of COVID-19 on small-scale direct marketing farmers in Northwest Arkansas and their responses to the pandemic,10.5304/jafscd.2022.121.006,2022,True
5327,"An Economic Analysis of Rewind, Premium, and Standard Efficiency Vertical Hollow Shaft Motors for Irrigation",10.13031/aea.13107,2020,True
5328,Adoption and Use of E-Grocery Shopping in the Context of the COVID-19 Pandemic: Implications for Transport Systems and Beyond,10.15760/etd.7658,2021,True
5329,Compensation as a Police Candidate Attraction Tool: An Organizational-Level Analysis,10.1177/1098611117713679,2017,True
5330,"Tree regeneration, understory development, and biomass dynamics following wildfire in a mountain hemlock (Tsuga mertensiana) forest",10.1016/j.foreco.2016.09.047,2017,True
5331,Three Theories of Copyright in Ratings,10.31228/osf.io/ut4bj,2018,True
5332,"Turbidity Responses from Timber Harvesting, Wildfire, and Post-Fire Logging in the Battle Creek Watershed, Northern California",10.1007/s00267-018-1036-3,2018,True
5333,"Understanding the Predictors of Low Take-Up of the Special Supplemental Nutrition Program for Women, Infants, and Children (WIC): A Nationwide Longitudinal Study",10.1007/s10995-023-03728-y,2023,True
5334,Epidemiologic and economic considerations regarding persistently infected cattle during vaccinate-to-live strategies for control of foot-and-mouth disease in FMD-free regions,10.3389/fvets.2022.1026592,2022,True
5335,"Cost of living variation, non-metropolitan America, and implications for the Supplemental Poverty Measure",10.31235/osf.io/6rax9,2021,True
5336,"Community food assistance, informal social networks, and the labor of care",10.1007/s10460-019-09943-0,2019,True
5337,"Assessing the Absorption and Economic Impact of Suppression and Repair Spending of the 2017 Eagle Creek Fire, Oregon",10.1093/jofore/fvac001,2022,True
5338,City Planning and Energy Use ☆,10.1016/b978-0-12-809665-9.09113-8,2018,True
5339,Regionalization of an Existing Global Forest Canopy Height Model for Forests of the Southern United States,10.3390/rs13091722,2021,True
5340,Partisan Fertility and Presidential Elections,10.3386/w29058,2021,True
5341,Failure by design: lessons from the recently rescinded light brown apple moth (<scp><i>Epiphyas postvittana</i></scp>) eradication program in California,10.1002/ps.7246,2022,True
5342,Housing Market Interventions and Residential Mobility in the San Francisco Bay Area,10.24148/cdwp2022-01,2022,True
5343,"Food Stamps, Income Shocks, and Crime: Evidence from California",10.1515/bejeap-2018-0034,2018,True
5344,"Temperature sensitive electricity demand and policy implications for energy transition: a case study of Florida, USA",10.3389/fsuep.2023.1271035,2024,True
5345,"Ailanthus altissima in Urban Neighborhoods of Denver, Colorado",10.56902/etdcrp.2014.8,2023,True
5346,"Race, Socioeconomic Status, and Food Access in Two Predominantly White Cities: The Case of Lansing, East Lansing, and Surrounding Townships in Michigan",10.3390/su152015065,2023,True
5347,"Climate Change, Agency Decision-Making, and the Resilience of Land-Based Livelihoods",10.1175/wcas-d-19-0097.1,2020,True
5348,Do obese and nonobese consumers respond differently to price changes? Implications of preference heterogeneity for <scp>obesity‐oriented</scp> food taxes and subsidies,10.1111/ajae.12418,2023,True
5349,Repeatable enhancement of healthcare data with social determinants of health,10.3389/fdata.2022.894598,2022,True
5350,Local policy and landowner attitudes: A case study of forest fragmentation,10.1016/j.landurbplan.2018.08.026,2019,True
5351,Secondary disturbance following a deposit of volcanic tephra: a 30-year record from old-growth forest understory,10.1139/cjfr-2020-0473,2021,True
5352,A synthesis of harvested wood product carbon models,10.2737/pnw-gtr-1020,2024,True
5353,Evaluating the effect of city ordinances on the implementation and performance of green stormwater infrastructure (GSI),10.1016/j.envc.2021.100183,2021,True
5354,Popular Support for Balancing Equity and Efficiency in Resource Allocation: A Case Study in Online Advertising to Increase Welfare Program Awareness,10.1609/icwsm.v17i1.22163,2023,True
5355,"Effects of landscape characteristics, anthropogenic factors, and seasonality on water quality in Portland, Oregon",10.1007/s10661-022-10821-2,2022,True
5356,Spatial regulation of taxicab services: Measuring empty travel in New York City,10.5198/jtlu.2018.1063,2018,True
5357,Shared Equity Homeownership in the United States: A Literature Review,10.1177/0885412218795142,2018,True
5358,Substitution between Immigrant and Native Farmworkers in the United States: Does Legal Status Matter?,10.2478/izajodm-2019-0007,2019,True
5359,A Scoping Review of Nutritional Biomarkers Associated with Food Security,10.3390/nu15163576,2023,True
5360,How do the U.S and Canadian Social Safety Nets Compare for Women and Children?,10.3386/w23380,2017,True
5361,Low Genetic Diversity Suggests the Recent Introduction of Dogwood Powdery Mildew to North America,10.1094/pdis-01-19-0051-re,2019,True
5362,"Sociodemographic Inequities in Telemedicine Use Among US Patients Initiating Treatment in Community Cancer Centers During the Ongoing COVID-19 Pandemic, 2020-2022",10.1200/op.23.00144,2023,True
5363,Which approaches are associated with better outcomes? Evidence from a national study of environmental education field trip programs for adolescent youth in the United States,10.1080/13504622.2022.2145270,2022,True
5364,The pox of politics: Troesken’s tradeoff reexamined,10.1007/s11127-022-01002-3,2022,True
5365,Cognitive Hubs and Spatial Redistribution,10.21144/wp19-16,2019,True
5366,Scrutinizing functional interaction networks from RNA-binding proteins to their targets in cancer,10.1109/bibm.2018.8621502,2018,True
5367,Real Denial Rates: A New Tool to Look at Who Is Receiving Mortgage Credit,10.1080/10511482.2018.1524441,2018,True
5368,Evaluating Draft EPA Emissions Models for Laying Hen Facilities,10.13031/ja.15237,2023,True
5369,Fine scale assessment of cross boundary wildfire events in the Western US,10.5194/nhess-2019-56,2019,True
5370,Pentecostals and Interreligious Conflict in India,10.1558/ptcs.31724,2017,True
5371,Community Structure and Demography in a Saline Pan-Dune Mosaic in the Western Mojave Desert,10.5642/aliso.20173502.04,2017,True
5372,Benchmarked small area prediction,10.1002/cjs.11461,2018,True
5373,Integrating the results of a nonresponse follow-up survey into the survey from which its items were selected,10.3233/sji-170406,2019,True
5374,From “Vision” to Reality: Emerging Public Opinion of Collaborative Management in the Greater Yellowstone Ecosystem,10.1080/08941920.2018.1456591,2018,True
5375,Accounting for the Impact of Medicaid on Child Poverty,10.3386/w25973,2019,True
5376,Data-Driven Analysis of Rural Equity and Cost Concerns for Mileage-Based User Fees in Vermont,10.1177/03611981231206167,2023,True
5377,For-Profit Hospitals Have a Unique Opportunity to Serve as Anchor Institutions in the U.S.,10.21203/rs.3.rs-55367/v1,2020,True
5378,"Supplemental Nutrition Assistance Program Emergency Allotments and Food Security, Hospitalizations, and Hospital Capacity",10.1001/jamanetworkopen.2023.26332,2023,True
5379,Harnessing heterogeneity in space with statistically guided meta-learning,10.1007/s10115-023-01847-0,2023,True
5380,"Cover crops, crop insurance losses, and resilience to extreme weather events",10.1111/ajae.12431,2023,True
5381,The Role of Beach Nourishment on the Success of Invasive Asiatic Sand Sedge,10.1656/045.024.0202,2017,True
5382,Do Minimum Wage Increases Affect SNAP Benefits?,10.1515/bejeap-2018-0045,2019,True
5383,Effect of Kumura (Benincasa hispida) on the Physico-chemical and Storage Quality Characteristics of Duck Meat Loaves,10.20546/ijcmas.2019.802.325,2019,True
5384,Digital Food and Beverage Marketing Environments in a National Sample of Middle Schools: Implications for Policy and Practice,10.1111/josh.12813,2019,True
5385,"Forest degradation modifies litter production, quality, and decomposition dynamics in Southern temperate forests",10.3389/fsoil.2023.1111694,2023,True
5386,"Real-Time Poverty, Material Well-Being, and the Child Tax Credit",10.3386/w30371,2022,True
5387,"Association of opioid fills with centers for disease control and prevention opioid guidelines and payer coverage policies: physician, insurance and geographic factors",10.1007/s11096-021-01360-w,2021,True
5388,"A Hedonic Analysis of Big Game Hunting Club Dues in Georgia, USA",10.1080/10871209.2017.1263767,2017,True
5389,Local brand entry and incumbent variety response: evidence from the ice cream market,10.1017/age.2021.5,2021,True
5390,A 117 year retrospective analysis of Pennsylvania tick community dynamics,10.1101/433664,2018,True
5391,GIS modeling of agricultural suitability in the highlands of the Jornada branch of the Mogollon culture of southcentral New Mexico,10.1016/j.jasrep.2018.09.009,2018,True
5392,The Fire Adapted Communities Pathways Tool: Facilitating Social Learning and a Science of Practice,10.1093/jofore/fvad044,2023,True
5393,Ex-post Evaluation of Mergers in the Supermarket Industry,10.1007/s11151-017-9608-6,2017,True
5394,SRRT: A decision support tool to inform postfire reforestation of ponderosa pine and Douglas-fir in the southern Rocky Mountains,10.2737/rmrs-rn-95,2022,True
5395,A Thousand Cuts: Cumulative Lead Exposure Reduces Academic Achievement,10.31235/osf.io/wz73u,2022,True
5396,How has COVID-19 impacted customer perceptions and demand for delivery services: An exploratory analysis,10.1016/j.tranpol.2023.02.020,2023,True
5397,Structural Characteristics of Nursing Homes and Social Service Directors that Influence Their Engagement in Disaster Preparedness Processes,10.1080/01634372.2021.1933293,2021,True
5398,"Addressing Changing Demographics in Environmental Justice Analysis, State of Practice",10.15760/trec.216,2019,True
5399,"Diaper Need During the COVID-19 Pandemic Associated with Poverty, Food Insecurity, and Chronic Illness: An Analysis of a Representative State Sample of Caretakers with Young Children",10.1089/heq.2021.0093,2022,True
5400,Development of an optimization model for biofuel facility size and location and a simulation model for design of a biofuel supply chain,10.37099/mtu.dc.etds/555,2020,True
5401,"Trips to Food Services, Food Retailers, and their Relationship with the Healthfulness of Food Purchases",10.1017/aae.2022.27,2022,True
5402,"Effects of non-ionizing electromagnetic fields on flora and fauna, part 1. Rising ambient EMF levels in the environment",10.1515/reveh-2021-0026,2021,True
5403,An exploration of preferences for soil health practices in potato production,10.1016/j.farsys.2023.100054,2023,True
5404,"High Food Insecurity in Latinx Families and Associated COVID-19 Infection in the Greater Bay Area, California",10.1101/2020.10.11.20210906,2020,True
5405,The effect of various social determinants of health on overall survival in the SCLC population.,10.1200/jco.2023.41.16_suppl.8588,2023,True
5406,A Novel Approach for Predicting Large Wildfires Using Machine Learning towards Environmental Justice via Environmental Remote Sensing and Atmospheric Reanalysis Data across the United States,10.3390/rs15235501,2023,True
5407,Has Global Agricultural Trade Been Resilient Under Covid-19? Findings from an Econometric Assessment of 2020,10.3386/w29551,2021,True
5408,Equality Denied: Tech and African Americans,10.36687/inetwp177,2022,True
5409,The Role of the Local Community on Federal Lands: The Weaverville Community Forest,10.55671/0160-4341.1076,2018,True
5410,Borealization and its discontents: drivers of regional variation in plant diversity across scales in interior Alaska,10.1002/ecs2.3485,2021,True
5411,Colony Breeding Structure of Reticulitermes (Isoptera: Rhinotermitidae) in Northwest Arkansas,10.13102/sociobiology.v66i3.4376,2019,True
5412,Store brands and retail grocery competition,10.1111/jems.12254,2018,True
5413,"Spatial evaluation of healthcare accessibility across archipelagic communities of Maluku Province, Indonesia",10.1371/journal.pgph.0001600,2023,True
5414,Avoiding Material Hardship: The Buffer Function of Wealth,10.31235/osf.io/7v6mt,2021,True
5415,Managing forest habitat for conservation-reliant species in a changing climate: The case of the endangered Kirtland’s Warbler,10.1016/j.foreco.2018.08.026,2018,True
5416,Impact Geographies of Wind Energy Development in Kansas,10.58809/quat8236,2019,True
5417,The effects of perceptions on consumer acceptance of genetically modified (GM) foods,10.31390/gradschool_dissertations.3547,2022,True
5418,Detection of toxins and harmful algal bloom cells in shellfish hatcheries and efforts toward removal,10.1016/j.aquaculture.2022.738714,2023,True
5419,"The geography of higher education of Newfoundland and Labrador, Canada",10.1787/5599133d-en,2023,True
5420,Confronting Immigration Myths with the Reality: A Necessary Perspective for Culturally Grounded Social Work Practice,10.1080/00377317.2018.1437995,2018,True
5421,Natural Resource Dependence and Rural American Economic Prosperity from 2000 to 2015,10.31235/osf.io/5pcwm,2019,True
5422,"The Intrinsic and Instrumental Values of Blockchain to Provide Beef Traceability in Hong Kong, South Korea, and the United States",10.3390/foods12234209,2023,True
5423,Pityopsis ruthii: An Updated Review of Conservation Efforts for an Endangered Plant,10.3390/plants12142693,2023,True
5424,Has COVID-19 ‘broken’ our food supply chain?,10.1287/orms.2020.06.02,2020,True
5425,The USDA Forest Service’s Forest Inventory and Analysis Database and the National Register of Champion Trees — A Potentially Symbiotic Relationship,10.1093/jofore/fvad058,2024,True
5426,Understanding Food Planning Strategies of Food Insecure Populations: Implications for Food-Agentic Technologies,10.1145/3544548.3581568,2023,True
5427,From Refuse to Reuse: How Much do Consumers Know about the Reclaimed Lumber Industry?,10.13073/fpj-d-22-00053,2023,True
5428,Site Characteristics Associated with Conventional and Unconventional Petroleum Development in West Virginia,10.33915/etd.7056,2019,True
5429,Avian Occupancy Dynamics and Canada Warbler (Cardellina canadensis) Environmental Correlates on a Central Appalachian Elevation Gradient in West Virginia,10.33915/etd.3778,2019,True
5430,Have electronic benefits cards improved food access for food stamp recipients?,10.1108/jes-10-2016-0193,2017,True
5431,Attuning to Need: Reconceptualizing “Help” in Poor Rural Areas,10.61611/2165-4611.1227,2021,True
5432,Maritime Freight Data Collection Systems and Database to Support Performance Measures and Market Analyses,10.36501/0197-9191/20-021,2020,True
5433,Road salt intrusion dynamics in an ex-urban native wetland complex,10.1371/journal.pwat.0000148,2023,True
5434,Seed dispersal and tree legacies influence spatial patterns of plant invasion dynamics,10.3389/fams.2023.1086781,2023,True
5435,Quality over Quantity: Nonmarket Values of Restoring Coastal Dunes in the U.S. Pacific Northwest,10.3368/le.040721-0036r,2022,True
5436,"Food environments and gut microbiome health: availability of healthy foods, alcohol, and tobacco in a rural Oklahoma tribal community",10.1007/s44187-022-00020-w,2022,True
5437,"A Data Processing Methodology to Analyze Construction and Demolition Dynamics in the European Metropolis of Lille, France",10.3390/buildings13102671,2023,True
5438,Service provider perceived barriers to addressing elder abuse: An elder abuse needs assessment,10.31274/etd-20210114-109,2021,True
5439,"Economics at the FCC 2021–22: 5G Spectrum Auctions, Affordable Connectivity, Broadband Data Collection, and Merger Review",10.1007/s11151-022-09887-6,2022,True
5440,"Childhood Obesity, Food Choice, and Market Influence",10.1016/b978-0-12-812840-4.00032-3,2019,True
5441,Assessing consistency among indices to measure socioeconomic barriers to health care access,10.1007/s10742-021-00257-5,2021,True
5442,Structural Racism and the Will to Act,10.5195/rt.2018.358,2018,True
5443,Nonprofit organizations in the making of civic community : exploring how the structure of nonprofit sectors matters for community wellbeing,10.31390/gradschool_dissertations.1020,2022,True
5444,Checklist of vascular plants for Wind River Indian Reservation (USA) high-elevation basins: ecological drivers of community assemblages,10.5091/plecevo.2020.1682,2020,True
5445,"“When people who use drugs can’t differentiate between medical care and cops, it’s a problem.” Compounding risks of law Enforcement Harassment &amp; Punitive Healthcare Policies",10.1186/s40352-023-00256-3,2024,True
5446,"Use case development for earth monitoring, analysis, and prediction (EarthMAP)—A road map for future integrated predictive science at the U.S. Geological Survey",10.3133/ofr20211108,2022,True
5447,Arctic science education using public museum collections from the University of Alaska Museum: an evolving and expanding landscape,10.1139/as-2017-0010,2017,True
5448,Climate-based policies may increase life-cycle social costs of vehicle fleet operation,10.1016/j.enpol.2016.11.018,2017,True
5449,AN ECONOMIC ANALYSIS OF FOOD SAFETY AND PUBLIC HEALTH: MILK PASTEURIZATION IN THE UNITED STATES,10.23860/diss-wang-huiqiang-2015,2020,True
5450,A Review of Health Survey Research for People with Refugee Background Resettled from Africa: Research Gaps and Methodological Issues,10.1007/s40615-018-0511-0,2018,True
5451,Preliminary Assessment of Spatial Competition in the Market for E85: Presentation Supplement,10.2172/1343482,2017,True
5452,Capital vs. income‐dependent optimal birth date in two North American ungulates,10.1002/ecs2.1766,2017,True
5453,Predictors of sustainment of two distinct nutrition and physical activity programs in early care and education,10.3389/frhs.2022.1010305,2022,True
5454,Role of Hurricane Disturbance in the Dynamics of the Southern Mixed Hardwood Forest: A Case Study in Northern Florida.,10.31390/gradschool_disstheses.6318,2022,True
5455,Business Group Spillovers,10.3386/w31107,2023,True
5456,Farmed Mussels in the Northeastern U.S. Exclusive Economic Zone: An Opportunity Too Good to Ignore,10.1002/fsh.10365,2020,True
5457,Real-time mapping of natural disasters using citizen update streams,10.1080/13658816.2019.1639185,2019,True
5458,"Critical Chorology and Peasant Production: Small Farm Forestry in Hojancha, Guanacaste, Costa Rica.",10.31390/gradschool_disstheses.5917,2022,True
5459,Ecological risk and protective factors for food insufficiency in Los Angeles County during the COVID-19 pandemic,10.1017/s1368980023001337,2023,True
5460,The food patterns of southern Louisiana residents,10.31390/gradschool_theses.3736,2022,True
5461,Effects of restoration and fire on habitats and populations of western hummingbirds: A literature review,10.2737/rmrs-gtr-408,2020,True
5462,A Study of Arizona Physician Relocation Patterns by Rurality and Primary Care Status,10.22454/fammed.55.619324,2023,True
5463,Species distribution model for the ‘Northern’ Oak hairstreak (Satyrium favonius ontario) with comments on its conservation status in the northeastern United States,10.1007/s10841-017-0001-4,2017,True
5464,A multi-level modeling approach to guide management of female feral hogs in Great Smoky Mountains National Park,10.1007/s10530-023-03086-4,2023,True
5465,Cognitive aging in rural communities: preliminary memory characterization of a community cohort from Southern Nevada,10.3389/frdem.2023.1236039,2023,True
5466,A Regularized Raking Estimator for Small-Area Mapping from Forest Inventory Surveys,10.3390/f10111045,2019,True
5467,The Impact of an Environmental Shock on Black-White Inequality: Evidence from the Boll Weevil,10.3386/w27101,2020,True
5468,"Production, prices, employment, and trade in Northwest forest industries, all quarters 2004.",10.2737/pnw-rb-250,2023,True
5469,Melding Wildlife Surveys to Improve Conservation Inference,10.1111/biom.13903,2023,True
5470,Improving Trip Generation Methods for Livable Communities,10.15760/trec.159,2017,True
5471,Dietary Exposure to Oxidized Lipids in US Infants,10.1101/2022.06.22.22276754,2022,True
5472,,10.22382/bpb-2019-002,2019,True
5473,Survey of Federal Community Resilience Programs and Available Resilience Planning Tools,10.6028/nist.gcr.21-027,2021,True
5474,Familial correlates of US preschooler physical activity,10.1080/17482798.2019.1570959,2019,True
5475,Development of Effective Procedures for Illicit-Discharge Risk Mapping,10.1061/(asce)wr.1943-5452.0000747,2017,True
5476,Warm temperatures and host tree abundance explain variation in directional spread by laurel wilt,10.1007/s10530-023-03069-5,2023,True
5477,America’s Continuing Struggle with Mental Illnesses: Economic Considerations,10.1257/jep.37.2.153,2023,True
5478,A socioeconomic and spatial analysis of obesity in West Virginia: Policy implications,10.33915/etd.2502,2019,True
5479,The Impact of Health on Labor Market Outcomes: Experimental Evidence from MRFIT,10.3386/w24231,2018,True
5480,Literacy's Role in Health Disparities,10.1097/tin.0000000000000148,2018,True
5481,Spatial Distribution of Wildfire Threat in the Far North: Exposure Assessment in Boreal Communities,10.21203/rs.3.rs-2949561/v1,2023,True
5482,A Study of Consumer Handling Behaviors during Transport from Retail to Residence Utilizing an Electronic Questionnaire,10.22175/mmb2017.12.0058,2018,True
5483,"Influence of climate, fruit availability and nutritional content on bird selection of non-native, invasive (Frangula alnus) and native (Prunus serotina) fruit in eastern Massachusetts",10.17760/d20002734,2021,True
5484,U.S. Safety Net Programs and Early Life Skills Formation: Results from a Prospective Longitudinal Cohort Study,10.3386/w24832,2018,True
5485,Certification and Recertification in Welfare Programs: What Happens When Automation Goes Wrong?,10.3386/w31437,2023,True
5486,Associations of geographic-based socioeconomic factors and HPV vaccination among male and female children in five US states,10.1186/s12889-024-18206-5,2024,True
5487,"Data and Code for ""Climate impacts and adaptation in US dairy systems 1981-2018""",10.5281/zenodo.4818011,2021,True
5488,"Prescribed Fire Use Among Black Landowners in the Red Hills Region, USA",10.14237/ebl.14.1.2023.1855,2023,True
5489,"Habitat associations and conservation opportunities for priority birds on small, diversified farms in the northeastern USA",10.1017/s1742170523000273,2023,True
5490,"An Observational, Irrigation-Sensitive Agricultural Drought Record from Weather Data",10.1175/jhm-d-23-0026.1,2023,True
5491,Does Information Disclosure Improve Consumer Knowledge? Evidence from a Randomized Experiment of Restaurant Menu Calorie Labels,10.3386/w27126,2020,True
5492,"Data and Code for ""Climate impacts and adaptation in US dairy systems 1981-2018""",10.5281/zenodo.4818010,2021,True
5493,The political economy of state right to farm amendments: evidence from Missouri,10.17811/ebl.11.3.2022.93-97,2022,True
5494,"Bushler Bay and Hood View, 40 Years on: Gender, Forests and Change in the Global North",10.55671/0160-4341.1069,2018,True
5495,Static Seeding and Clustering of LSTM Embeddings to Learn From Loosely Time-Decoupled Events,10.1109/access.2023.3288487,2023,True
5496,Using mobile phone data to evaluate access to essential services following natural hazards,10.1111/risa.14201,2023,True
5497,Rain Garden Sedges Tolerate Cyclical Flooding and Drought,10.21273/hortsci13234-18,2018,True
5498,"COVID-19, Violent Crime, and Domestic Violence: An Exploratory Analysis",10.1007/s43576-022-00049-y,2022,True
5499,Review: <i>Beyond the Kale: Urban Agriculture and Social Justice Activism in New York City</i>,10.1177/0739456x17714027,2017,True
5500,"Grape Leaffolder, Desmia funeralis (Hübner) (Insecta: Lepidoptera: Crambidae)",10.32473/edis-in349-2022,2022,True
5501,Incomplete program take-up during a crisis: evidence from the COVID-19 shock in one U.S. state,10.1007/s10797-022-09760-y,2022,True
5502,Conserving a threatened North American walnut: a chromosome-scale reference genome for butternut (<i>Juglans cinerea</i>),10.1101/2023.05.12.539246,2023,True
5503,Estimating visitor preferences for recreation sites in wildfire prone areas,10.1071/wf21133,2022,True
5504,Universities as Arts and Cultural Anchors,10.34053/artivate.10.2.150,2021,True
5505,"Exploration of millennials' perception of spending on cities, mass transit, and highways",10.1016/j.jtrangeo.2018.04.002,2018,True
5506,A gridded inventory of annual 2012-2018 U.S. anthropogenic methane emissions,10.31223/x5rq3m,2023,True
5507,Greening Development: Reducing Urban Tree Canopy Loss through Incentives,10.20944/preprints202310.0030.v1,2023,True
5508,Treefall gap characteristics within an Appalachian hardwood forest in West Virginia: Influences of topographic position and forest type,10.33915/etd.2907,2019,True
5509,Pacific Northwest Plants Record Multiannual Atmosphere–Ocean Circulation Patterns,10.1029/2021jd035454,2021,True
5510,An Investigation into Equations for Estimating Water Requirements and the Development of New Equations for Predicting Total Water Intake,10.25148/etd.fi11040602,2017,True
5511,An Optimization Technique for Ranch Management,10.33423/jabe.v25i2.6111,2023,True
5512,"The Equine Industry: Competing Beliefs, Change and Conflict",10.28945/4399,2019,True
5513,The Role of Forest Setting on Partnership Demand and Engagement Approaches,10.1093/forsci/fxy016,2018,True
5514,Globalization of area studies: an analysis of collection development resources,10.1108/cc-08-2017-0039,2018,True
5515,Partitioning and Transport Behavior of Pathogen Indicator Organisms at Four Cold Region Solid Waste Sites,10.1061/(asce)cr.1943-5495.0000111,2017,True
