,title,doi,year,exists_in_openalex
1697,A Simplified Framework for High-Resolution Urban Vegetation Classification with Optical Imagery in the Los Angeles Megacity,10.3390/rs12152399,2020,True
1698,Quantitative approach for the risk assessment of African swine fever and Classical swine fever introduction into the United States through legal imports of pigs and swine products,10.1371/journal.pone.0182850,2017,True
1699,Marketing of Hawai’i Food Products in China,10.1080/10971475.2017.1297649,2017,True
1700,The potential for urban household vegetable gardens to reduce greenhouse gas emissions,10.1016/j.landurbplan.2016.07.008,2017,True
1701,Using multiple coding schemes for classification and coding of agricultural injury,10.1002/ajim.22932,2018,True
1702,Extreme weather and marriage among girls and women in Bangladesh,10.1016/j.gloenvcha.2020.102160,2020,True
1703,Household food security and use of community food sources and food assistance programs among food shoppers in neighborhoods of low income and low food access,10.1080/19320248.2017.1364188,2017,True
1704,Resident support for urban greenways across diverse neighborhoods: Comparing two Atlanta BeltLine segments,10.1016/j.landurbplan.2018.08.021,2018,True
1705,"Use of social media, search queries, and demographic data to assess obesity prevalence in the United States",10.1057/s41599-019-0314-x,2019,True
1706,Seizing the moment: The opportunity and relevance of the California Conservation Genomics Project to state and federal conservation policy,10.1093/jhered/esac046,2022,True
1707,Austerity urbanism or pragmatic municipalism? Local government responses to fiscal stress in New York State,10.1177/0308518x19844794,2019,True
1708,United States Dietary Trends Since 1800: Lack of Association Between Saturated Fatty Acid Consumption and Non-communicable Diseases,10.3389/fnut.2021.748847,2022,True
1709,Intensification of Midwestern Agriculture as a Regional Climate Modifier and Atmospheric Boundary Layer Moisture Source,10.1080/24694452.2019.1598842,2019,True
1710,A geographic identifier assignment algorithm with Bayesian variable selection to identify neighborhood factors associated with emergency department visit disparities for asthma,10.1186/s12942-020-00203-7,2020,True
1711,Center-Reported Adherence to Nutrition Standards of the Child and Adult Care Food Program,10.1089/chi.2018.0076,2018,True
1712,Childhood Circumstances and Adult Outcomes: Act II,10.3386/w23017,2017,True
1713,Do farmers need to be paid to grow milkweed for monarchs or will they volunteer if it is easy enough?,10.1002/aepp.13290,2022,True
1714,Assessing Progress Toward Greater Equality of Income Distribution,10.4324/9780429311208-22,2019,True
1715,Intergenerational mobility of low‐income youth in metropolitan and non‐metropolitan America: A spatial analysis,10.1111/rsp3.12122,2018,True
1716,DNA Template Dilution Impacts Amplicon Sequencing-Based Estimates of Soil Fungal Diversity,10.1094/pbiomes-09-17-0037-r,2018,True
1717,Phosphorus Transport in Intensively Managed Watersheds,10.1029/2018wr024009,2019,True
1718,"Hydrologic, land cover, and seasonal patterns of waterborne pathogens in Great Lakes tributaries",10.1016/j.watres.2017.01.060,2017,True
1719,Quantifying impacts of white-tailed deer (Odocoileus virginianus Zimmerman) browse using forest inventory and socio-environmental datasets,10.1371/journal.pone.0201334,2018,True
1720,Fleeting Agencies,10.1017/9781108837385,2020,True
1721,The mobility of food retailers: How proximity to SNAP authorized food retailers changed in Atlanta during the Great Recession,10.1016/j.socscimed.2018.05.046,2018,True
1722,Private provision of public goods by environmental groups,10.1073/pnas.1805336115,2018,True
1723,Visual Attention to Eco-Labels Predicts Consumer Preferences for Pollinator Friendly Plants,10.3390/su9101743,2017,True
1724,"Land conservation can mitigate freshwater ecosystem services degradation due to climate change in a semiarid catchment: The case of the Portneuf River catchment, Idaho, USA",10.1016/j.scitotenv.2018.09.260,2019,True
1725,Modelling H5N1 in Bangladesh across spatial scales: Model complexity and zoonotic transmission risk,10.1016/j.epidem.2017.02.007,2017,True
1726,Herbivory by the biocontrol agent Lilioceris cheni suppresses propagule production and smothering ability of the invasive vine Dioscorea bulbifera,10.1016/j.biocontrol.2018.12.001,2019,True
1727,Profile and Economic Impacts of Agriculture and Natural Resource Industries in the Northwest Region of Florida,10.32473/edis-fe620-2005,2019,True
1728,Buyer and Nonbuyer Barriers to Purchasing Local Food,10.1017/age.2016.40,2017,True
1729,"The Impacts of Prescribed Fire on PM2.5 Air Quality and Human Health: Application to Asthma-Related Emergency Room Visits in Georgia, USA",10.3390/ijerph16132312,2019,True
1730,"Associations between Environmental Quality and Mortality in the Contiguous United States, 2000–2005",10.1289/ehp119,2017,True
1731,"Injury/Fatality-Causing Incidents Involving the Rearward Movement of Agricultural Machinery: Types, Causes, and Preventive Measures",10.3390/safety3010008,2017,True
1732,"<scp>LAGOS‐US LOCUS</scp> v1.0: Data module of location, identifiers, and physical characteristics of lakes and their watersheds in the conterminous <scp>U.S.</scp>",10.1002/lol2.10203,2021,True
1733,Evaluating the effects of open space configurations in reducing flood damage along the Gulf of Mexico coast,10.1016/j.landurbplan.2017.07.003,2017,True
1734,"Surface Runoff Responses to Suburban Growth: An Integration of Remote Sensing, GIS, and Curve Number",10.3390/land10050452,2021,True
1735,"Baseline Assessment of a Healthy Corner Store Initiative: Associations between Food Store Environments, Shopping Patterns, Customer Purchases, and Dietary Intake in Eastern North Carolina",10.3390/ijerph14101189,2017,True
1736,"Public knowledge, contaminant concerns, and support for recycled Water in the United States",10.1016/j.resconrec.2019.104419,2019,True
1737,Administrative Centralization and Bureaucratic Responsiveness: Evidence from the Food Stamp Program,10.1093/jopart/mux022,2017,True
1738,The US National Mall Microbiome: A Census of Rhizosphere Bacteria Inhabiting Landscape Turf,10.2135/cropsci2016.10.0849,2017,True
1739,"SNAP-Ed Policy, Systems, and Environmental Interventions and Caregivers’ Dietary Behaviors",10.1016/j.jneb.2020.05.013,2020,True
1740,"Mapping Rural Education Research: A Systematic Review of Methods, Geographies, and Definitions",10.3102/1431926,2019,True
1741,A Tale of Two Cancers: Traveling to Treat Pancreatic and Thyroid Cancer,10.1016/j.jamcollsurg.2017.02.017,2017,True
1742,Expanding vulnerability assessment for public lands: The social complement to ecological approaches,10.1016/j.crm.2017.01.005,2017,True
1743,The Local Economic and Welfare Consequences of Hydraulic Fracturing,10.3386/w23060,2017,True
1744,A Response to Scientific and Societal Needs for Marine Biological Observations,10.3389/fmars.2019.00395,2019,True
1745,Profile and Economic Impacts of Agriculture and Natural Resource Industries in the Northeast Region of Florida,10.32473/edis-fe619-2005,2019,True
1746,The Tension Between Worker Safety and Organization Survival,10.1287/mnsc.2020.3589,2020,True
1747,Lost in the Black Belt South: health outcomes and transportation infrastructure,10.1007/s10661-019-7416-1,2019,True
1748,Exploring emotional response to images used in agritourism destination marketing,10.1016/j.jdmm.2017.10.004,2018,True
1749,From XS to XL Urban Nature: Examining Access to Different Types of Green Space Using a ‘Just Sustainabilities’ Framework,10.3390/su12176998,2020,True
1750,Resource curse? The case of Kern County,10.1016/j.resourpol.2018.08.018,2018,True
1751,Dietary Intake Patterns among Lactating and Non-Lactating Women of Reproductive Age in Rural Zambia,10.3390/nu11020288,2019,True
1752,Decadal-Scale Reduction in Forest Net Ecosystem Production Following Insect Defoliation Contrasts with Short-Term Impacts of Prescribed Fires,10.3390/f9030145,2018,True
1753,Local Union Organization and Law Making in the US Congress,10.1086/694546,2018,True
1754,Erasing Rural Massachusetts: Consolidation and the Urban Revolution in Education,10.47381/aijre.v29i2.198,2019,True
1755,"Governance matters: climate change, corruption, and livelihoods in Bangladesh",10.1007/s10584-018-2139-9,2018,True
1756,The Information Society,10.20896/saci.v4i3.248,2017,True
1757,"Community Engaged Cumulative Risk Assessment of Exposure to Inorganic Well Water Contaminants, Crow Reservation, Montana",10.3390/ijerph15010076,2018,True
1758,A DNA metabarcoding approach to characterize soil arthropod communities,10.1016/j.soilbio.2018.06.026,2018,True
1759,Impact of market conditions on the effectiveness of payments for forest-based carbon sequestration,10.1016/j.forpol.2018.03.009,2018,True
1760,Sex and Race/Ethnic Disparities in Food Security and Chronic Diseases in U.S. Older Adults,10.1177/2333721417718344,2017,True
1761,The importance of growing up: juvenile environment influences dispersal of individuals and their neighbours,10.1111/ele.13166,2018,True
1762,The Evolution of Racehorse Clusters in the United States: Geographic Analysis and Implications for Sustainable Agricultural Development,10.3390/su12020494,2020,True
1763,"The impact of industrial oil development on a protected area landscape: demographic and social change at Murchison Falls Conservation Area, Uganda",10.1007/s11111-017-0287-x,2017,True
1764,Changes in Water Quality of Grand Lake St. Marys Watershed Following Implementation of a Distressed Watershed Rules Package,10.2134/jeq2017.08.0338,2018,True
1765,Do State Farm-to-School–Related Laws Increase Participation in Farm-to-School Programs?,10.1080/19320248.2017.1284026,2017,True
1766,A Comparison of Major Environmental Justice Screening and Mapping Tools,10.5296/emsd.v6i1.10914,2017,True
1767,Using models to provide rapid programme support for California's efforts to suppress Huanglongbing disease of citrus,10.1098/rstb.2018.0281,2019,True
1768,Recognizing the ‘sparsely settled forest’: Multi-decade socioecological change dynamics and community exemplars,10.1016/j.landurbplan.2017.10.009,2018,True
1769,Meals Enhancing Nutrition After Discharge: Findings from a Pilot Randomized Controlled Trial,10.1016/j.jand.2016.11.005,2017,True
1770,Peak grain forecasts for the US High Plains amid withering waters,10.1073/pnas.2008383117,2020,True
1771,Racial disparities in mortality for patients with prostate cancer after radical prostatectomy,10.1002/cncr.33152,2020,True
1772,Spatial scaling of urban impervious surfaces across evolving landscapes: From cities to urban regions,10.1016/j.landurbplan.2018.03.010,2018,True
1773,The relative importance of queen and king initial weights in termite colony foundation success,10.1007/s00040-019-00690-3,2019,True
1774,The true costs of US agricultural dumping,10.1017/s1742170519000097,2019,True
1775,Sustainable Development for Whom and How? Exploring the Gaps between Popular Discourses and Ground Reality Using the Mexican Jatropha Biodiesel Case,10.1007/s00267-017-0848-x,2017,True
1776,Examples and Case Studies of Beneficial Reuse of Beef Cattle By-Products,10.2136/sssabookser6.c13,2018,True
1777,"Remittances, Child Labor, and Schooling: Evidence from Colombia",10.1086/702790,2020,True
1778,Smokey Bear and the pyropolitics of United States forest governance,10.1016/j.polgeo.2017.10.005,2018,True
1779,Cohort profile: the ChicagO Multiethnic Prevention and Surveillance Study (COMPASS),10.1136/bmjopen-2020-038481,2020,True
1780,Improving BMP Cost-Share Enrollment Rates: Insights from a Survey of Florida Farmers,10.1017/age.2020.5,2020,True
1781,"Findings from the initial Stepwise Approach to Rabies Elimination (SARE) Assessment in China, 2019",10.1371/journal.pntd.0009274,2021,True
1782,Hierarchically nested river landform sequences. Part 2: Bankfull channel morphodynamics governed by valley nesting structure,10.1002/esp.4410,2018,True
1783,Analyzing land-use change scenarios for trade-offs among cultural ecosystem services in the Southern Rocky Mountains,10.1016/j.ecoser.2017.02.003,2017,True
1784,Improved representation of agricultural land use and crop management for large-scale hydrological impact simulation in Africa using SWAT+,10.5194/hess-26-71-2022,2022,True
1785,Are Plant-Based Analogues Replacing Cow’s Milk in the American Diet?,10.1017/aae.2020.16,2020,True
1786,Reproducibility and Replicability in Economics,10.1162/99608f92.4f6b9e67,2020,True
1787,Beyond the school grounds: Links between density of tree cover in school surroundings and high school academic performance,10.1016/j.ufug.2018.11.001,2019,True
1788,A hybrid modeling framework to estimate pollutant concentrations and exposures in near road environments,10.1016/j.scitotenv.2019.01.218,2019,True
1789,Securing a sustainable future for US seafood in the wake of a global crisis,10.1016/j.marpol.2020.104328,2021,True
1790,"Patterns of cover crop use, adoption, and impacts among Indiana farmers",10.1080/15427528.2018.1432515,2018,True
1791,Irrigation efficiency and water withdrawal in US agriculture,10.2166/wp.2019.175,2019,True
1792,A Review of Changes in US Logging Businesses 1980s–Present,10.1093/jofore/fvx014,2018,True
1793,2017 Renewable Energy Data Book,10.2172/1581221,2019,True
1794,The relationship between price and retail concentration: evidence from the US food industry,10.1093/erae/jby026,2018,True
1795,Urban Immigrant Diversity and Inclusive Institutions,10.1080/00130095.2017.1300056,2017,True
1796,"The SNAP-Ed Evaluation Framework: Nationwide Uptake and Implications for Nutrition Education Practice, Policy, and Research",10.1016/j.jneb.2020.10.015,2021,True
1797,Applying Climate Change Risk Management Tools to Integrate Streamflow Projections and Social Vulnerability,10.1007/s10021-019-00387-5,2019,True
1798,Trends in Drought over the Northeast United States,10.3390/w11091834,2019,True
1799,A National Perspective on Women Owning Woodlands (WOW) Networks,10.34068/joe.55.02.08,2017,True
1800,Health and Safety in Organic Farming: A Qualitative Study,10.1080/1059924x.2017.1382409,2018,True
1801,Facing reality: the growth of virtual reality and health sciences libraries,10.5195/jmla.2017.329,2017,True
1802,Market trends for seafood products in the USA: Implication for Southern aquaculture products,10.1080/13657305.2017.1266710,2017,True
1803,How dietary transition changed land use in Mexico,10.1007/s13280-020-01317-9,2020,True
1804,An Evaluation of Local Comprehensive Plans Toward Sustainable Green Infrastructure in US,10.3390/su10114143,2018,True
1805,Examining Factors Associated With Farmers' Climate-Adaptive and Maladaptive Actions in the U.S. Midwest,10.3389/fclim.2021.677548,2021,True
1806,Clustered housing cycles,10.1016/j.regsciurbeco.2017.06.003,2017,True
1807,A National Framework for Urban Extension,10.34068/joe.55.05.21,2017,True
1808,Wish you were here? The prevalence of farmers markets in food deserts: an examination of the United States,10.1080/15528014.2018.1549467,2018,True
1809,"Health and greenhouse gas mitigation benefits of ambitious expansion of cycling, walking, and transit in California",10.1016/j.jth.2017.04.011,2017,True
1810,The Implementation and Food Safety Issues Associated With Poultry Processing Reuse Water for Conventional Poultry Production Systems in the United States,10.3389/fsufs.2018.00070,2018,True
1811,"Temporal and spatial foraging patterns of three Asian honey bee species in Bangalore, India",10.1007/s13592-020-00839-1,2021,True
1812,Coccidioidomycosis: Increasing Incidence of an “Orphan” Disease in Response to Environmental Changes,10.1007/978-3-319-60616-3_6,2017,True
1813,Use of Polyethylene and Plastic Biodegradable Mulches among Tennessee Fruit and Vegetable Growers,10.21273/horttech04559-19,2020,True
1814,Persistence and Path Dependence in the Spatial Economy,10.3386/w28059,2020,True
1815,"Rural Native and European American Custodial Grandparents: Stressors, Resources, and Resilience",10.1007/s10823-019-09372-w,2019,True
1816,Planning with Unauthorized Immigrant Communities,10.1177/0885412217698403,2017,True
1817,"TICK VECTOR AND DISEASE PATHOGEN SURVEILLANCE OF NILGAI ANTELOPE (<i>BOSELAPHUS TRAGOCAMELUS</i>) IN SOUTHEASTERN TEXAS, USA",10.7589/2017-09-239,2018,True
1818,"Creating an Environment for Economic Growth: Creativity, Entrepreneurship or Human Capital?",10.1111/1468-2427.12555,2017,True
1819,Exploring the Determinants of Variations in Land Use Policy Outcomes: What Makes Urban Containment Work?,10.1177/0739456x19865300,2019,True
1820,"We Don’t Have a Lot of Healthy Options: Food Environment Perceptions of First-Year, Minority College Students Attending a Food Desert Campus",10.3390/nu11040816,2019,True
1821,Poverty as a function of space: understanding the spatial configuration of poverty in Malaysia for Sustainable Development Goal number one,10.1007/s10708-018-9926-8,2018,True
1822,"Alternative futures of dissolved inorganic nitrogen export from the Mississippi River Basin: influence of crop management, atmospheric deposition, and population growth",10.1007/s10533-017-0331-z,2017,True
1823,"Relative Deprivation, Absolute Deprivation, and Homicide: Testing an Interaction Between Income Inequality and Disadvantage",10.1177/1088767918782938,2018,True
1824,Cultivating Benefit and Risk: Aquaculture Representation and Interpretation in New England,10.1080/08941920.2018.1480821,2018,True
1825,Q Chat Space: Assessing the Feasibility and Acceptability of an Internet-Based Support Program for LGBTQ Youth,10.1007/s11121-021-01291-y,2021,True
1826,Group Gardening in a Native American Community: A Collaborative Approach,10.1177/1524839919830930,2019,True
1827,Market Channel Procurement Strategy and School Meal Costs in Farm-to-School Programs,10.1017/age.2019.18,2019,True
1828,Evaluating scale and technical efficiency among farms and ranches with a local market orientation,10.1017/s1742170517000680,2017,True
1829,A Multilevel Examination of Local Newspaper Credibility,10.1177/1077699017721486,2017,True
1830,HCAHPS Scores and Community Factors,10.1177/1062860618765977,2018,True
1831,A statewide urban tree canopy mapping method,10.1016/j.rse.2019.03.037,2019,True
1832,Health Impacts of Food Assistance: Evidence from the United States,10.1146/annurev-resource-100518-093823,2019,True
1833,A Survey of Public Perceptions and Attitudes about Water Availability Following Exceptional Drought in Texas,10.1111/j.1936-704x.2019.03297.x,2019,True
1834,"Nitarsone, Inorganic Arsenic, and Other Arsenic Species in Turkey Meat: Exposure and Risk Assessment Based on a 2014 U.S. Market Basket Sample",10.1289/ehp225,2017,True
1835,Social media indicators of the food environment and state health outcomes,10.1016/j.puhe.2017.03.013,2017,True
1836,An investigation of predictability dynamics of temperature and precipitation in reanalysis datasets over the continental United States,10.1016/j.atmosres.2016.09.017,2017,True
1837,Differences in the Neighborhood Retail Food Environment and Obesity Among US Children and Adolescents by SNAP Participation,10.1002/oby.22184,2018,True
1838,Risk factors for anaemia among Ghanaian women and children vary by population group and climate zone,10.1111/mcn.13076,2020,True
1839,The influence of the Environmental Quality Incentives Program on local water quality,10.1111/ajae.12316,2022,True
1840,Landowner and Practitioner Perspectives on Private Land Conservation Programs,10.1080/08941920.2017.1376139,2017,True
1841,"Linking Industrial Hazards and Social Inequalities: Environmental Injustice in Gujarat, India",10.3390/ijerph16010042,2018,True
1842,"Business, Owner, and Regional Characteristics in Latino-owned Business Growth: An Empirical Analysis Using Confidential Census Microdata",10.1177/0160017619826278,2019,True
1843,"The Motivations and Needs of Rural, Low-Income Household Food Gardeners",10.5304/jafscd.2020.092.002,2020,True
1844,Development and Validation of a County-Level Social Determinants of Health Risk Assessment Tool for Cardiovascular Disease,10.1370/afm.2534,2020,True
1845,Growth and Yield Responses of Leafy Vegetables Grown in Organic and Conventional Agriculture Systems,10.12924/of2022.08010003,2022,True
1846,Proximity to parks and natural areas as an environmental determinant to spatial disparities in obesity prevalence,10.1016/j.apgeog.2019.102074,2019,True
1847,Fracking Fortunes: Economic Well‐being and Oil and Gas Development along the Urban‐Rural Continuum,10.1111/ruso.12198,2017,True
1848,"Isotope values of California vole (Microtus californicus) hair relate to historical drought and land use patterns in California, USA",10.1007/s00442-019-04457-2,2019,True
1849,Unemployment and Development,10.3386/w25171,2018,True
1850,Enhancing racial diversity in the Association for Environmental Studies and Sciences,10.1007/s13412-018-0518-1,2018,True
1851,Phenology of the Dalmatian Toadflax Biological Control Agent Mecinus janthiniformis (Coleoptera: Curculionidae) in Utah,10.1093/ee/nvx174,2017,True
1852,Shopping pattern and food purchase differences among Supplemental Nutrition Assistance Program (SNAP) households and Non-supplemental Nutrition Assistance Program households in the United States,10.1016/j.pmedr.2017.06.005,2017,True
1853,Understanding temporal and spatial variations of viral disease in the US: The need for a one-health-based data collection and analysis approach,10.1016/j.onehlt.2019.100105,2019,True
1854,Agricultural and geographic factors shaped the North American 2015 highly pathogenic avian influenza H5N2 outbreak,10.1371/journal.ppat.1007857,2020,True
1855,"Impact of human factors on wildfire occurrence in Mississippi, United States",10.1016/j.forpol.2017.04.011,2017,True
1856,Rural-Nonrural Differences in Telemedicine Use for Mental and Substance Use Disorders Among Medicaid Beneficiaries,10.1176/appi.ps.201900444,2020,True
1857,Spatio-temporal multinomial autologistic modeling of land-use change: A parcel-level approach,10.1177/2399808318786511,2018,True
1858,"Chronic Obstructive Pulmonary Disease Mortality by Industry and Occupation — United States, 2020",10.15585/mmwr.mm7149a3,2022,True
1859,National trends in radiation dose escalation for glioblastoma,10.3857/roj.2019.00017,2019,True
1860,Green infrastructure for coastal flood protection: The longitudinal impacts of green infrastructure patterns on flood damage,10.1016/j.apgeog.2021.102565,2021,True
1861,Prioritizing sites for conservation based on similarity to historical baselines and feasibility of protection,10.1111/cobi.13128,2018,True
1862,Economic and environmental analyses of coal and biomass to liquid fuels,10.1016/j.energy.2017.09.047,2017,True
1863,"Changes in Farmland Ownership in Oregon, USA",10.3390/land8030039,2019,True
1864,Enhancing interdisciplinary climate change work through comprehensive evaluation,10.1016/j.crm.2016.11.003,2017,True
1865,"Allocating emissions to 4 km and 1 km horizontal spatial resolutions and its impact on simulated NOx and O3 in Houston, TX",10.1016/j.atmosenv.2017.06.026,2017,True
1866,Healthy Eating among Mexican Immigrants: Migration in Childhood and Time in the United States,10.1177/0022146518788869,2018,True
1867,Broadband's relationship to rural housing values,10.1111/pirs.12450,2019,True
1868,Grandmother and health care professional breastfeeding perspectives provide opportunities for health promotion in an American Indian community,10.1016/j.socscimed.2018.05.017,2018,True
1869,Characterizing equitable access to grocery stores during disasters using location-based data,10.1038/s41598-022-23532-y,2022,True
1870,"The Veggie Van: Customer characteristics, fruit and vegetable consumption, and barriers to healthy eating among shoppers at a mobile farmers market in the United States",10.1016/j.appet.2018.11.025,2019,True
1871,Voluntary food labeling: The additive effect of “free from” labels and region of origin,10.1002/agr.21558,2018,True
1872,OSM Data Import as an Outreach Tool to Trigger Community Growth? A Case Study in Miami,10.3390/ijgi7030113,2018,True
1873,Evaluation of the Use of Zero-Augmented Regression Techniques to Model Incidence of <i>Campylobacter</i> Infections in FoodNet,10.1089/fpd.2017.2308,2017,True
1874,"Effects of business maturity, experience, and size on farms economic vitality",10.1108/afr-03-2016-0026,2017,True
1875,Food insecurity and physical activity insecurity among rural Oregon families,10.1016/j.pmedr.2017.07.006,2017,True
1876,Study Protocol: A Cross-Sectional Examination of Socio-Demographic and Ecological Determinants of Nutrition and Disease Across Madagascar,10.3389/fpubh.2020.00500,2020,True
1877,"A multidisciplinary coastal vulnerability assessment for local government focused on ecosystems, Santa Barbara area, California",10.1016/j.ocecoaman.2019.104921,2019,True
1878,Prospects for New England Agriculture: Farm to Fork,10.1017/age.2019.33,2019,True
1879,Land and poverty: the role of soil fertility and vegetation quality in poverty reduction,10.1017/s1355770x20000066,2020,True
1880,Residential mobility in early childhood and the impact on misclassification in pesticide exposures,10.1016/j.envres.2019.03.039,2019,True
1881,Are SDGs suitable for China’s sustainable development assessment? An application and amendment of the SDGs Indicators in China,10.1080/10042857.2018.1544753,2018,True
1882,Logging Industry in the United States: Employment and Profitability,10.3390/f12121720,2021,True
1883,"Examining the Food Retail Choice Context in Urban Food Deserts, Ohio, 2015",10.5888/pcd14.160408,2017,True
1884,"Heritage, Tourism, and Race",10.4324/9781003029014,2020,True
1885,Payments for ecosystem services within the hybrid governance model: evaluating policy alignment and complementarity on California rangelands,10.5751/es-12254-260119,2021,True
